{
  "$schema": "https://json-schema.org/draft/2020-12/schema",
  "$id": "https://schemas.belegt.org/io/battery-passport-cf-fragment.json",
  "title": "Belegt EU battery passport carbon footprint fragment (Reg. (EU) 2023/1542 Art. 7, Annex II, Annex XIII 1(b)(c))",
  "$comment": "Field names follow Battery Pass / DIN DKE SPEC 99100 conventions [needs verification]. Belegt-defined fragment.",
  "type": "object",
  "required": ["fragment", "templateMapping", "mode", "created", "manufacturer", "batteryModel", "manufacturingPlant", "omittedFields"],
  "additionalProperties": false,
  "properties": {
    "fragment": { "const": "eu_battery_passport.carbon_footprint" },
    "templateMapping": { "const": "tm:eu_battery_passport@2023-1542" },
    "mode": { "enum": ["upstream", "passport"] },
    "created": { "type": "string", "pattern": "^\\d{4}-\\d{2}-\\d{2}T\\d{2}:\\d{2}:\\d{2}Z$" },
    "manufacturer": {
      "type": "object", "required": ["name"], "additionalProperties": false,
      "properties": { "name": { "type": "string", "minLength": 1 }, "id": { "type": "string" } }
    },
    "batteryModel": {
      "type": "object", "required": ["id", "category"], "additionalProperties": false,
      "properties": { "id": { "type": "string", "minLength": 1 }, "name": { "type": "string" }, "category": { "enum": ["ev", "lmt", "industrial"] } }
    },
    "manufacturingPlant": {
      "type": "object", "required": ["country"], "additionalProperties": false,
      "properties": { "country": { "type": "string", "pattern": "^[A-Z]{2}$" }, "name": { "type": "string" }, "address": { "type": "string" } }
    },
    "batteryChemistry": { "type": "string", "minLength": 1 },
    "batteryCarbonFootprint": {
      "type": "object",
      "required": ["declarationStatus", "functionalUnit", "unit", "carbonFootprintPerFunctionalUnit"],
      "additionalProperties": false,
      "properties": {
        "declarationStatus": { "const": "not_a_declaration" },
        "functionalUnit": { "type": "string" },
        "unit": { "const": "kgCO2e/kWh" },
        "carbonFootprintPerFunctionalUnit": { "type": "number", "minimum": 0 },
        "lifecycleStages": {
          "type": "object",
          "required": ["rawMaterialAcquisitionAndPreProcessing", "mainProductProduction", "distribution", "endOfLifeAndRecycling"],
          "additionalProperties": false,
          "properties": {
            "rawMaterialAcquisitionAndPreProcessing": { "type": "number" },
            "mainProductProduction": { "type": "number" },
            "distribution": { "type": "number" },
            "endOfLifeAndRecycling": { "type": "number" }
          }
        }
      }
    },
    "omittedFields": {
      "type": "array",
      "items": { "type": "object", "required": ["field", "reason"], "properties": { "field": { "type": "string" }, "reason": { "type": "string" } }, "additionalProperties": false }
    }
  }
}
