{
  "fragment": "eu_battery_passport.carbon_footprint",
  "templateMapping": "tm:eu_battery_passport@2023-1542",
  "mode": "upstream",
  "created": "2026-10-19T00:00:00Z",
  "manufacturer": {
    "name": "Demo Cells GmbH"
  },
  "batteryModel": {
    "id": "DC-NMC-77",
    "name": "Pack 77 kWh",
    "category": "ev"
  },
  "manufacturingPlant": {
    "country": "DE"
  },
  "batteryChemistry": "nmc",
  "batteryCarbonFootprint": {
    "declarationStatus": "not_a_declaration",
    "functionalUnit": "kWh of total energy provided over expected service life",
    "unit": "kgCO2e/kWh",
    "carbonFootprintPerFunctionalUnit": 61.4,
    "lifecycleStages": {
      "rawMaterialAcquisitionAndPreProcessing": 44.1,
      "mainProductProduction": 14.2,
      "distribution": 1.3,
      "endOfLifeAndRecycling": 1.8
    }
  },
  "omittedFields": [
    {
      "field": "carbonFootprintPerformanceClass",
      "reason": "Art. 7(2) performance classes not yet defined"
    },
    {
      "field": "euDeclarationOfConformityId",
      "reason": "declaration-level field; not part of upstream exchange"
    },
    {
      "field": "studyWebLink",
      "reason": "declaration-level field; not part of upstream exchange"
    }
  ]
}
